lista morb  cid-10,2022,total,municipio_ibge,competencia
01 Algumas doenças infecciosas e parasitárias,1455,1455,130260,2022-07
Cólera,10,10,130260,2022-07
Amebíase,9,9,130260,2022-07
Diarréia e gastroenterite origem infecc presum,316,316,130260,2022-07
Outras doenças infecciosas intestinais,107,107,130260,2022-07
Tuberculose respiratória,37,37,130260,2022-07
Tuberculose pulmonar,30,30,130260,2022-07
Outras tuberculoses respiratórias,4,4,130260,2022-07
Restante de tuberculose respiratória,3,3,130260,2022-07
Outras tuberculoses,5,5,130260,2022-07
Tuberculose do sistema nervoso,1,1,130260,2022-07
Tuberculose miliar,3,3,130260,2022-07
Restante de outras tuberculoses,1,1,130260,2022-07
Hanseníase [lepra],1,1,130260,2022-07
Infecção meningocócica,1,1,130260,2022-07
Septicemia,246,246,130260,2022-07
Outras doenças bacterianas,228,228,130260,2022-07
Outras formas de leptospirose,1,1,130260,2022-07
Leptospirose não especificada,3,3,130260,2022-07
Restante de outras doenças bacterianas,224,224,130260,2022-07
Sífilis congênita,13,13,130260,2022-07
Outras sífilis,1,1,130260,2022-07
Outras infecções com transm predominant sexual,2,2,130260,2022-07
Febres recorrentes,4,4,130260,2022-07
Encefalite viral,4,4,130260,2022-07
Outras febre p/arbovírus e febr hemorr p/vírus,31,31,130260,2022-07
Dengue [dengue clásssico],25,25,130260,2022-07
Febre hemorrágica devida ao vírus da dengue,2,2,130260,2022-07
Restante outr febr arbovírus febr hemor vírus,4,4,130260,2022-07
Infecções pelo vírus do herpes,1,1,130260,2022-07
Varicela e herpes zoster,8,8,130260,2022-07
Hepatite aguda B,1,1,130260,2022-07
Outras hepatites virais,18,18,130260,2022-07
Doença pelo vírus da imunodefic humana [HIV],245,245,130260,2022-07
Caxumba [parotidite epidêmica],4,4,130260,2022-07
Outras doenças virais,111,111,130260,2022-07
Meningite viral,1,1,130260,2022-07
Restante de outras doenças virais,110,110,130260,2022-07
Micoses,6,6,130260,2022-07
Malária,35,35,130260,2022-07
Malária por Plasmodium falciparum,5,5,130260,2022-07
Malária por Plasmodium vivax,25,25,130260,2022-07
Malária por Plasmodium malariae,1,1,130260,2022-07
Malária não especificada,4,4,130260,2022-07
Leishmaniose,3,3,130260,2022-07
Leishmaniose cutânea,2,2,130260,2022-07
Leishmaniose cutâneo-mucosa,1,1,130260,2022-07
Outras helmintíases,1,1,130260,2022-07
Seqüelas de tuberculose,1,1,130260,2022-07
Seqüelas de hanseníase [lepra],2,2,130260,2022-07
Outras doenças infecciosas e parasitárias,4,4,130260,2022-07
02 Neoplasias (tumores),795,795,130260,2022-07
Neoplasia maligna do lábio cavid oral e faringe,20,20,130260,2022-07
Neoplasia maligna do esôfago,12,12,130260,2022-07
Neoplasia maligna do estômago,14,14,130260,2022-07
Neoplasia maligna do cólon,16,16,130260,2022-07
Neopl malig junção retoss reto ânus canal anal,14,14,130260,2022-07
Neopl malig fígado e vias biliares intra-hepát,13,13,130260,2022-07
Neoplasia maligna do pâncreas,5,5,130260,2022-07
Outras neoplasias malignas de órgãos digestivos,5,5,130260,2022-07
Neoplasias malignas de laringe,13,13,130260,2022-07
Neoplasia maligna de traquéia brônquios e pulm,21,21,130260,2022-07
Outras neopl malig órg respirat e intratorác,4,4,130260,2022-07
Neoplasia maligna do osso e cartilagem articul,8,8,130260,2022-07
Neoplasia maligna da pele,1,1,130260,2022-07
Outras neoplasias malignas da pele,7,7,130260,2022-07
Neopl malig do tecido mesotelial e tec moles,10,10,130260,2022-07
Neoplasia maligna da mama,56,56,130260,2022-07
Neoplasia maligna do colo do útero,45,45,130260,2022-07
Neopl malig outr porções e porç não espec útero,15,15,130260,2022-07
Outras neopl malignas órgãos genitais femininos,15,15,130260,2022-07
Neoplasia maligna da próstata,19,19,130260,2022-07
Outras neopl malignas órgãos genit masculinos,4,4,130260,2022-07
Neoplasia maligna da bexiga,5,5,130260,2022-07
Outras neoplasias malignas do trato urinário,8,8,130260,2022-07
Neoplasia maligna do encéfalo,3,3,130260,2022-07
Neopl malig outras partes sistema nerv central,1,1,130260,2022-07
Neopl malig outr local mal def secun e não esp,34,34,130260,2022-07
Doença de Hodgkin,3,3,130260,2022-07
Linfoma não-Hodgkin,20,20,130260,2022-07
Leucemia,74,74,130260,2022-07
Outras neopl malig tecidos linfóid hemat e rel,2,2,130260,2022-07
Carcinoma in situ de colo do útero,10,10,130260,2022-07
Neoplasia benigna da pele,2,2,130260,2022-07
Neoplasia benigna da mama,1,1,130260,2022-07
Leiomioma do útero,194,194,130260,2022-07
Neoplasia benigna do ovário,3,3,130260,2022-07
Neopl benig encéfalo e outr part sist nerv cent,4,4,130260,2022-07
Outr neopl in situ benigs e comport incert desc,114,114,130260,2022-07
03 Doenças sangue órgãos hemat e transt imunitár,174,174,130260,2022-07
Anemia por deficiência de ferro,13,13,130260,2022-07
Outras anemias,123,123,130260,2022-07
Afecç hemorrág e outr doenç sang e órg hematop,38,38,130260,2022-07
04 Doenças endócrinas nutricionais e metabólicas,499,499,130260,2022-07
Outros transtornos tireoidianos,4,4,130260,2022-07
Diabetes mellitus,409,409,130260,2022-07
Desnutrição,26,26,130260,2022-07
Depleção de volume,16,16,130260,2022-07
Outros transt endócrinos nutricionais metabólic,44,44,130260,2022-07
05 Transtornos mentais e comportamentais,81,81,130260,2022-07
Transt mentais e comportamentais dev uso álcool,2,2,130260,2022-07
Transt ment comport dev uso outr subst psicoat,4,4,130260,2022-07
Esquizofrenia transt esquizotípicos e delirant,56,56,130260,2022-07
Transtornos de humor [afetivos],15,15,130260,2022-07
Retardo mental,2,2,130260,2022-07
Outros transtornos mentais e comportamentais,2,2,130260,2022-07
06 Doenças do sistema nervoso,166,166,130260,2022-07
Doenças inflamatórias do sistema nervoso centr,4,4,130260,2022-07
Meningite bacteriana não classif outra parte,4,4,130260,2022-07
Doença de Parkinson,1,1,130260,2022-07
Doença de Alzheimer,2,2,130260,2022-07
Esclerose múltiplas,1,1,130260,2022-07
Epilepsia,54,54,130260,2022-07
Enxaqueca e outras síndromes de algias cefálic,7,7,130260,2022-07
Acid vascular cerebr isquêm transit e síndr cor,32,32,130260,2022-07
Transtornos dos nervos raízes e plexos nervosos,5,5,130260,2022-07
Paralisia cerebral e outras síndromes paralít,3,3,130260,2022-07
Outras doenças do sistema nervoso,57,57,130260,2022-07
07 Doenças do olho e anexos,44,44,130260,2022-07
Ceratite e outros transtornos esclerót e córnea,1,1,130260,2022-07
Descolamentos e defeitos da retina,29,29,130260,2022-07
Outras doenças do olho e anexos,14,14,130260,2022-07
08 Doenças do ouvido e da apófise mastóide,26,26,130260,2022-07
Otite média e outr transt ouvid médio apóf mast,22,22,130260,2022-07
Outras doenças do ouvido e da apófise mastóide,4,4,130260,2022-07
09 Doenças do aparelho circulatório,1271,1271,130260,2022-07
Febre reumática aguda,2,2,130260,2022-07
Doença reumática crônica do coração,20,20,130260,2022-07
Hipertensão essencial (primária),62,62,130260,2022-07
Outras doenças hipertensivas,50,50,130260,2022-07
Infarto agudo do miocárdio,230,230,130260,2022-07
Outras doenças isquêmicas do coração,147,147,130260,2022-07
Embolia pulmonar,3,3,130260,2022-07
Transtornos de condução e arritmias cardíacas,28,28,130260,2022-07
Insuficiência cardíaca,296,296,130260,2022-07
Outras doenças do coração,41,41,130260,2022-07
Hemorragia intracraniana,21,21,130260,2022-07
Infarto cerebral,7,7,130260,2022-07
Acid vascular cerebr não espec hemorrág ou isq,164,164,130260,2022-07
Outras doenças cerebrovasculares,48,48,130260,2022-07
Arteroesclerose,23,23,130260,2022-07
Outras doenças vasculares periféricas,4,4,130260,2022-07
Embolia e trombose arteriais,10,10,130260,2022-07
Outras doenças das artérias arteríolas e capil,33,33,130260,2022-07
Flebite tromboflebite embolia e trombose venosa,25,25,130260,2022-07
Veias varicosas das extremidades inferiores,20,20,130260,2022-07
Hemorróidas,23,23,130260,2022-07
Outras doenças do aparelho circulatório,14,14,130260,2022-07
10 Doenças do aparelho respiratório,2062,2062,130260,2022-07
Faringite aguda e amigdalite aguda,22,22,130260,2022-07
Laringite e traqueíte agudas,14,14,130260,2022-07
Outras infecções agudas das vias aéreas super,16,16,130260,2022-07
Influenza [gripe],38,38,130260,2022-07
Pneumonia,1392,1392,130260,2022-07
Bronquite aguda e bronquiolite aguda,199,199,130260,2022-07
Outras doenças do nariz e dos seios paranasais,6,6,130260,2022-07
Doenças crônicas das amígdalas e das adenóides,8,8,130260,2022-07
Outras doenças do trato respiratório superior,2,2,130260,2022-07
Bronquite enfisema e outr doenç pulm obstr crôn,45,45,130260,2022-07
Asma,109,109,130260,2022-07
Outras doenças do aparelho respiratório,211,211,130260,2022-07
11 Doenças do aparelho digestivo,2161,2161,130260,2022-07
Cárie dentária,1,1,130260,2022-07
Outros transtornos dentes e estruturas suporte,5,5,130260,2022-07
Outr doenç cavidade oral glând saliv e maxilar,2,2,130260,2022-07
Úlcera gástrica e duodenal,6,6,130260,2022-07
Gastrite e duodenite,16,16,130260,2022-07
Outras doenças do esôfago estômago e duodeno,35,35,130260,2022-07
Doenças do apêndice,343,343,130260,2022-07
Hérnia inguinal,287,287,130260,2022-07
Outras hérnias,195,195,130260,2022-07
Doença de Crohn e colite ulcerativa,1,1,130260,2022-07
Ileo paralítico e obstrução intestinal s/hérnia,60,60,130260,2022-07
Doença diverticular do intestino,3,3,130260,2022-07
Outras doenças dos intestinos e peritônio,162,162,130260,2022-07
Doença alcoólica do fígado,16,16,130260,2022-07
Outras doenças do fígado,67,67,130260,2022-07
Colelitíase e colecistite,732,732,130260,2022-07
Pancreatite aguda e outras doenças do pâncreas,47,47,130260,2022-07
Outras doenças do aparelho digestivo,183,183,130260,2022-07
12 Doenças da pele e do tecido subcutâneo,489,489,130260,2022-07
Infecções da pele e do tecido subcutâneo,260,260,130260,2022-07
Outras doenças da pele e do tecido subcutâneo,229,229,130260,2022-07
13 Doenças sist osteomuscular e tec conjuntivo,142,142,130260,2022-07
Artrite reumatóide e outr poliartropatias infl,13,13,130260,2022-07
Artrose,17,17,130260,2022-07
Deformidades adquiridas das articulações,3,3,130260,2022-07
Outros transtronos articulares,22,22,130260,2022-07
Doenças sistêmicas do tecido conjuntivo,6,6,130260,2022-07
Transt discais cervic e outr transt disc interv,7,7,130260,2022-07
Outras dorsopatias,12,12,130260,2022-07
Transtornos do tecido mole,48,48,130260,2022-07
Transtornos da densidade e da estrutura ósseas,5,5,130260,2022-07
Osteomielite,2,2,130260,2022-07
Outras doenças sist osteomuscular e tec conjunt,7,7,130260,2022-07
14 Doenças do aparelho geniturinário,1414,1414,130260,2022-07
Síndrome nefríticas aguda e rapidamente progres,14,14,130260,2022-07
Outras doenças glomerulares,31,31,130260,2022-07
Doenças renais túbulo-intersticiais,74,74,130260,2022-07
Insuficiência renal,175,175,130260,2022-07
Urolitíase,151,151,130260,2022-07
Cistite,15,15,130260,2022-07
Outras doenças do aparelho urinário,350,350,130260,2022-07
Hiperplasia da próstata,35,35,130260,2022-07
Outros transtornos da próstata,5,5,130260,2022-07
Hidrocele e espermatocele,11,11,130260,2022-07
Preprúcio redundante fimose e parafimose,70,70,130260,2022-07
Outras doenças dos órgãos genitais masculinos,25,25,130260,2022-07
Transtornos da mama,42,42,130260,2022-07
Salpingite e ooforite,25,25,130260,2022-07
Outras doenças inflamat órgãos pélvicos femin,76,76,130260,2022-07
Endometriose,30,30,130260,2022-07
Prolapso genital feminino,70,70,130260,2022-07
Transt não-inflam ovário tromp Falópio lig larg,73,73,130260,2022-07
Transtornos da menstruação,6,6,130260,2022-07
Transt menopáusicos e outr transt perimenopáus,2,2,130260,2022-07
Outros transtornos do aparelho geniturinário,134,134,130260,2022-07
15 Gravidez parto e puerpério,4561,4561,130260,2022-07
Aborto espontâneo,179,179,130260,2022-07
Aborto por razões médicas,9,9,130260,2022-07
Outras gravidezes que terminam em aborto,271,271,130260,2022-07
Edema protein transt hipertens grav parto puerp,127,127,130260,2022-07
Placent prév descol premat plac hemorr antepart,10,10,130260,2022-07
Outr mot ass mãe rel cav fet amn pos prob part,448,448,130260,2022-07
Trabalho de parto obstruído,117,117,130260,2022-07
Hemorragia pós-parto,3,3,130260,2022-07
Outras complicações da gravidez e do parto,1021,1021,130260,2022-07
Parto único espontâneo,2218,2218,130260,2022-07
Compl pred rel puerpério e outr afecç obst NCOP,158,158,130260,2022-07
16 Algumas afec originadas no período perinatal,548,548,130260,2022-07
Feto e rec-nasc afet fat mat e compl grav parto,1,1,130260,2022-07
Ret cres fet desn fet tran gest curt baix peso,111,111,130260,2022-07
Trauma durante o nascimento,1,1,130260,2022-07
Hipóxia intrauterina e asfixia ao nascer,11,11,130260,2022-07
Outros transt respiratórios orig per perinatal,87,87,130260,2022-07
Doenças infecciosas e parasitárias congênitas,62,62,130260,2022-07
Outras infecções específicas do período perinat,37,37,130260,2022-07
Doença hemolítica do feto e do recém-nascido,1,1,130260,2022-07
Outras afecções originadas no período perinatal,237,237,130260,2022-07
17 Malf cong deformid e anomalias cromossômicas,159,159,130260,2022-07
Espinha bífida,1,1,130260,2022-07
Outras malformações congênitas do sistema nerv,3,3,130260,2022-07
Malformações congênitas do aparelho circulat,59,59,130260,2022-07
Fenda labial e fenda palatina,31,31,130260,2022-07
Outras malformações congênitas aparelho digest,14,14,130260,2022-07
Testiculo não-descido,14,14,130260,2022-07
Outras malformações do aparelho geniturinário,12,12,130260,2022-07
Deformidades congênitas dos pés,6,6,130260,2022-07
Outr malform e deform congên aparelho osteomusc,5,5,130260,2022-07
Outras malformações congênitas,13,13,130260,2022-07
Anomalias cromossômicas NCOP,1,1,130260,2022-07
18 Sint sinais e achad anorm ex clín e laborat,167,167,130260,2022-07
Dor abdominal e pélvica,100,100,130260,2022-07
Febre de origem desconhecida,1,1,130260,2022-07
Outr sist sinais achad anorm ex clín labor NCOP,66,66,130260,2022-07
19 Lesões enven e alg out conseq causas externas,1396,1396,130260,2022-07
Fratura do crânio e dos ossos da face,18,18,130260,2022-07
Fratura do pescoço tórax ou pelve,8,8,130260,2022-07
Fratura do fêmur,98,98,130260,2022-07
Fratura de outros ossos dos membros,435,435,130260,2022-07
Fraturas envolvendo múltiplas regiões do corpo,97,97,130260,2022-07
Luxações entorse distensão reg esp e múlt corpo,27,27,130260,2022-07
Traumatismo do olho e da órbita ocular,2,2,130260,2022-07
Traumatismo intracraniano,59,59,130260,2022-07
Traumatismo de outros órgãos internos,60,60,130260,2022-07
Lesões esmag amput traumát reg esp e múlt corpo,18,18,130260,2022-07
Outr traum reg espec não espec e múltipl corpo,310,310,130260,2022-07
Efeitos corpo estranho através de orifício nat,27,27,130260,2022-07
Queimadura e corrosões,38,38,130260,2022-07
Envenenamento por drogas e substâncias biológ,5,5,130260,2022-07
Efeitos tóxicos subst origem princ não-medicin,101,101,130260,2022-07
Outros efeitos e não espec de causas externas,5,5,130260,2022-07
Cert compl prec traum compl cirúrg ass méd NCOP,77,77,130260,2022-07
Seqüel traum enven e outr conseq causas extern,11,11,130260,2022-07
21 Contatos com serviços de saúde,397,397,130260,2022-07
Pessoas em contato com serv saúde exame invest,83,83,130260,2022-07
Anticoncepção,197,197,130260,2022-07
Rastreamento pré-natal e outr superv da gravid,1,1,130260,2022-07
Pessoas contato serv saúde cuidados proc espec,112,112,130260,2022-07
Pessoas contato serv saúde por outras razões,4,4,130260,2022-07
